{
  "corpus-id": "abstract-t8-1",
  "entries": {
    "doc-0_12_0": {
      "annotation-sets": {
        "abstract-events": {
          "events": {
            "event1": {
              "agents": [
                "ss-4"
              ],
              "anchors": "ss-3",
              "eventid": "event1",
              "helpful-harmful": "harmful",
              "material-verbal": "material",
              "patients": [
                "ss-2"
              ]
            },
            "event2": {
              "agents": [
                "ss-2"
              ],
              "anchors": "ss-1",
              "eventid": "event2",
              "helpful-harmful": "neutral",
              "material-verbal": "material",
              "patients": [
                "ss-2"
              ]
            }
          },
          "span-sets": {
            "ss-1": {
              "spans": [
                {
                  "hstring": "pull away",
                  "string": "pull away"
                }
              ],
              "ssid": "ss-1"
            },
            "ss-2": {
              "spans": [
                {
                  "hstring": "bus",
                  "string": "a bus"
                }
              ],
              "ssid": "ss-2"
            },
            "ss-3": {
              "spans": [
                {
                  "hstring": "closed in",
                  "string": "closed in"
                }
              ],
              "ssid": "ss-3"
            },
            "ss-4": {
              "spans": [
                {
                  "hstring": "mob",
                  "string": "a mob"
                }
              ],
              "ssid": "ss-4"
            }
          }
        }
      },
      "doc-id": "doc-0",
      "entry-id": "doc-0_12_0",
      "segment-text": "On the afternoon of Oct. 7, 1974, a mob of 200 enraged whites, many of them students, closed in on a bus filled with black students that was trying to pull away from the local high school.",
      "segment-type": "sentence",
      "sent-id": "12"
    },
    "doc-0_28_0": {
      "annotation-sets": {
        "abstract-events": {
          "events": {
            "event1": {
              "agents": [],
              "anchors": "ss-10",
              "eventid": "event1",
              "helpful-harmful": "neutral",
              "material-verbal": "material",
              "patients": [
                "ss-11"
              ]
            },
            "event2": {
              "agents": [
                "ss-8"
              ],
              "anchors": "ss-7",
              "eventid": "event2",
              "helpful-harmful": "neutral",
              "material-verbal": "verbal",
              "patients": [
                "ss-9"
              ]
            },
            "event3": {
              "agents": [],
              "anchors": "ss-9",
              "eventid": "event3",
              "helpful-harmful": "harmful",
              "material-verbal": "material",
              "patients": []
            },
            "event4": {
              "agents": [
                "ss-2"
              ],
              "anchors": "ss-1",
              "eventid": "event4",
              "helpful-harmful": "neutral",
              "material-verbal": "verbal",
              "patients": [
                "ss-3"
              ]
            },
            "event5": {
              "agents": [
                "ss-5"
              ],
              "anchors": "ss-4",
              "eventid": "event5",
              "helpful-harmful": "harmful",
              "material-verbal": "material",
              "patients": [
                "ss-6"
              ]
            }
          },
          "span-sets": {
            "ss-1": {
              "spans": [
                {
                  "hstring": "insisted",
                  "string": "insisted"
                }
              ],
              "ssid": "ss-1"
            },
            "ss-10": {
              "spans": [
                {
                  "hstring": "found",
                  "string": "found"
                }
              ],
              "ssid": "ss-10"
            },
            "ss-11": {
              "spans": [
                {
                  "hstring": "weapon",
                  "string": "weapon"
                }
              ],
              "ssid": "ss-11"
            },
            "ss-2": {
              "spans": [
                {
                  "hstring": "driver",
                  "string": "The bus driver"
                }
              ],
              "ssid": "ss-2"
            },
            "ss-3": {
              "spans": [
                {
                  "hstring": "shot",
                  "string": "shot"
                }
              ],
              "ssid": "ss-3"
            },
            "ss-4": {
              "spans": [
                {
                  "hstring": "firing",
                  "string": "firing"
                }
              ],
              "ssid": "ss-4"
            },
            "ss-5": {
              "spans": [
                {
                  "hstring": "someone",
                  "string": "someone"
                }
              ],
              "ssid": "ss-5"
            },
            "ss-6": {
              "spans": [
                {
                  "hstring": "bus",
                  "string": "the bus"
                }
              ],
              "ssid": "ss-6"
            },
            "ss-7": {
              "spans": [
                {
                  "hstring": "indicate",
                  "string": "indicate"
                }
              ],
              "ssid": "ss-7"
            },
            "ss-8": {
              "spans": [
                {
                  "hstring": "evidence",
                  "string": "no evidence"
                }
              ],
              "ssid": "ss-8"
            },
            "ss-9": {
              "spans": [
                {
                  "hstring": "shot",
                  "string": "shot"
                }
              ],
              "ssid": "ss-9"
            }
          }
        }
      },
      "doc-id": "doc-0",
      "entry-id": "doc-0_28_0",
      "segment-text": "No weapon was found, and there was no evidence to indicate that the shot had come from the bus. The bus driver insisted it had not come from the bus, but from someone firing at the bus.",
      "segment-type": "sentence",
      "sent-id": "28"
    },
    "doc-0_47_0": {
      "annotation-sets": {
        "abstract-events": {
          "events": {
            "event1": {
              "agents": [
                "ss-2"
              ],
              "anchors": "ss-6",
              "eventid": "event1",
              "helpful-harmful": "neutral",
              "material-verbal": "material",
              "patients": []
            },
            "event2": {
              "agents": [
                "ss-2"
              ],
              "anchors": "ss-4",
              "eventid": "event2",
              "helpful-harmful": "neutral",
              "material-verbal": "verbal",
              "patients": [
                "ss-5"
              ]
            },
            "event3": {
              "agents": [],
              "anchors": "ss-5",
              "eventid": "event3",
              "helpful-harmful": "harmful",
              "material-verbal": "material",
              "patients": []
            },
            "event4": {
              "agents": [
                "ss-2"
              ],
              "anchors": "ss-1",
              "eventid": "event4",
              "helpful-harmful": "neutral",
              "material-verbal": "verbal",
              "patients": [
                "ss-3"
              ]
            },
            "event5": {
              "agents": [],
              "anchors": "ss-3",
              "eventid": "event5",
              "helpful-harmful": "harmful",
              "material-verbal": "material",
              "patients": []
            }
          },
          "span-sets": {
            "ss-1": {
              "spans": [
                {
                  "hstring": "report",
                  "string": "report"
                }
              ],
              "ssid": "ss-1"
            },
            "ss-2": {
              "spans": [
                {
                  "hstring": "witness",
                  "string": "the main witness"
                }
              ],
              "ssid": "ss-2"
            },
            "ss-3": {
              "spans": [
                {
                  "hstring": "kidnapping",
                  "string": "kidnapping"
                }
              ],
              "ssid": "ss-3"
            },
            "ss-4": {
              "spans": [
                {
                  "hstring": "reporting",
                  "string": "reporting"
                }
              ],
              "ssid": "ss-4"
            },
            "ss-5": {
              "spans": [
                {
                  "hstring": "crimes",
                  "string": "crimes"
                }
              ],
              "ssid": "ss-5"
            },
            "ss-6": {
              "spans": [
                {
                  "hstring": "witness",
                  "string": "witness"
                }
              ],
              "ssid": "ss-6"
            }
          }
        }
      },
      "doc-id": "doc-0",
      "entry-id": "doc-0_47_0",
      "segment-text": "Never mind that the main witness, a former girlfriend of Mr. Tyler's, was a troubled youngster who had been under the care of a psychiatrist and had a history of reporting phony crimes to the police, including a false report of a kidnapping.",
      "segment-type": "sentence",
      "sent-id": "47"
    },
    "doc-0_4_0": {
      "annotation-sets": {
        "abstract-events": {
          "events": {